,Tweet,User,createdTime,label
87,"#JUSTIN: Minister @KTRTRS also announced the enhancement of salaries of sanitation workers from Rs 14,500 to Rs 17,000 recognising their services during the corona pandemic.",b'NewsMeter_In',2020-11-14 09:51:58,sanitation
88,"Majestic decision from #TRSGovt of 50% #PropertyTax rebate for everyone who pay upto Rs15,000.  Also a salary hike of sanitation workers to Rs 17,500 from Rs 14,500 !   #DildarCM  #ThankYouKTR   @KTRTRS @YadavTalasani @mahmoodalitrs @trspartyonline https://t.co/dltGvSKpzt",b'ysathishreddy',2020-11-14 09:51:09,sanitation
89,@KTRTRS very very good decision of relief to municipal sanitation workers... We love this type of works... I ask why you not keep public toilets to work.. many number of toilets not working in city.. Appoint and give responsibility to sanitation workers and give salary.,b'goudhyd25',2020-11-14 09:35:48,sanitation
90,"I cannot express my appreciation of our CM #KCR garu for his kind heart towards the people who suffered from Floods.Thanks  for exempting 50% property tax for upto 15,000/-and 10,000/- for all the flood affected families&amp; salary enhancement for sanitation workers. @KTRTRS",b'AnilgoudB',2020-11-14 09:21:49,sanitation
91,"I cannot express my appreciation of our CM #KCR garu for his kind heart towards the people who suffered from Floods.Thanks  for exempting 50% property tax for upto 15,000/-and 10,000/- for all the flood affected families&amp; salary enhancement for sanitation workers. @KTRTRS https://t.co/O2jbIkAiEj",b'kp_vivekanand',2020-11-14 08:48:40,sanitation
92,Happy Dewali to GHMC sanitation workers #Telangana government increased Their Salaries from  14k to 17k #HyderabadWithTrs Thank you @TelanganaCMO @GHMCOnline @CommissionrGHMC https://t.co/rMq7WpgTMY,b'shinde8324',2020-11-14 08:23:22,sanitation
93,"Doubling the joy on Diwali. Govt of Telangana has announced  50% waiver on Property Tax. Those not received flood relief amount of Rs 10.000 can apply thru Mee SEVA. Salary Increment of Rs 3000 to Sanitation workers.From Rs14,500 raised to Rs17,500 @KTRTRS https://t.co/K07agLJGeq",b'KaleemTRS',2020-11-14 08:06:54,sanitation
94,"#SwachhRamagundam #SwachhSurvekshan2021 Conducted a meeting with sanitation workers, Staff of MEPMA,Engineering, Sanitation&amp;Revenue on Swachh Survekshan -2021 and Felicitated best performing workers for the month of October. @KTRTRS @arvindkumar_ias @cdmatelangana @Collector_PDPL https://t.co/1wHqVRr8Ub",b'MC_Ramagundam',2020-11-13 06:14:36,sanitation
95,"Special Sanitation Drive for removing of Garbage, C&amp;D waste and Green waste is in progress at various locations of #Goshamahal division of Khairatabad zone. @GHMCOnline @AC_sanitation @ZC_Khairatabad @TigerRajaSingh @TRSParmeshwari @MamtaManga https://t.co/A5OcNlXjs7",b'Deeswmgoshamahl',2020-11-13 04:25:31,sanitation
96,@KTRTRS @KTRTRS  please take care of existing Basti dawakhanas. The one in king koti is one such example for bad maintenance ... it doesn’t even have proper sanitation facilities for lady doctors..... #BastiDawakhanas,b'ASarangula',2020-11-12 17:01:53,sanitation
97,AIMIM Bhainsa Chairman Mohd Jabir Ahmed inaugurated Citizen  Service Center and Sanitation Vehicle in Bhainsa and on the successful representation of Barrister @asadowaisi ₹15 crores of development works has also been approved by District Collector @musharraf_ias @KTRTRS https://t.co/jR3OkRfetY,b'HafizShazHyd',2020-11-12 13:46:18,sanitation
